{
  "manifestVersion": 1,
  "id": "e-launcher.webfox",
  "version": "1.0.0",
  "kind": "plugin",
  "displayName": "Webfox",
  "hostApi": "^1.0.0",
  "durableApi": "1.4.0",
  "components": {
    "host": {
      "entry": "entry.js"
    }
  },
  "platforms": [
    "windows",
    "linux",
    "android"
  ],
  "configSchema": "config.schema.json",
  "uiSchema": "ui.schema.json",
  "stateVersion": 1,
  "contributions": [
    "tools"
  ]
}
